,index,Route,Location,URL,Avg Stars,Your Stars,Route Type,Rating,Pitches,Length,Area Latitude,Area Longitude,Description
386,386,Happy Buddha,Owen's Boulder > Pennypack Park > Philly > Southeastern Lowlands > Pennsylvania,https://www.mountainproject.com/route/120216296/happy-buddha,1.3,-1,Boulder,V1,1,,40.07464,-75.06203,Sit start with good holds on the bulge to the far left. Climb straight up over the bulge and top out.
387,387,Easy Shoobie,The Cove > Pennypack Park > Philly > Southeastern Lowlands > Pennsylvania,https://www.mountainproject.com/route/117099155/easy-shoobie,1.0,-1,Boulder,V0,1,,40.07769,-75.05608,Stand start and climb the jugs on the right arête.Beta Video
388,388,Hazy Summer,The Cove > Pennypack Park > Philly > Southeastern Lowlands > Pennsylvania,https://www.mountainproject.com/route/117099176/hazy-summer,2.0,-1,Boulder,V0,1,,40.07769,-75.05608,"Sit down start on a rock on left side. Grab slopers above, throw high, right and back, match, and top out.Beta Video(fromrockclimbing.com)"
389,389,Lazy Summer,The Cove > Pennypack Park > Philly > Southeastern Lowlands > Pennsylvania,https://www.mountainproject.com/route/117100439/lazy-summer,2.0,-1,Boulder,V2,1,,40.07769,-75.05608,Sit down start with an undercling above the low ledge in middle of face. Traverse right to join the left-slanting crack. Follow the crack up and top out.Beta Video(fromrockclimbing.com)
390,390,Nano Standstart,Geocache Boulder > Pennypack Park > Philly > Southeastern Lowlands > Pennsylvania,https://www.mountainproject.com/route/117815106/nano-standstart,1.0,-1,Boulder,V-easy,1,,40.04918,-75.03737,Standstart matched on the large side pull. Use the large crimp to step up onto the left slab and move up.Beta VideoVariation V0: Same SDS as First to Start but set left onto the slab using the crimp.
391,391,Basic Member,Geocache Boulder > Pennypack Park > Philly > Southeastern Lowlands > Pennsylvania,https://www.mountainproject.com/route/117815215/basic-member,1.0,-1,Boulder,V0-,1,,40.04918,-75.03737,Stand start on the left end of the long juggy crack. Traverse right and move up to top out.
392,392,First To Find,Geocache Boulder > Pennypack Park > Philly > Southeastern Lowlands > Pennsylvania,https://www.mountainproject.com/route/117814515/first-to-find,2.0,-1,Boulder,V0,1,,40.04918,-75.03737,SDS with the lowest part of the large side pull and a slopey feature to the right on the bulge. Bump your right to a jug and move up on crimps at the top.Beta Video
393,393,Smurfs 292,Geocache Boulder > Pennypack Park > Philly > Southeastern Lowlands > Pennsylvania,https://www.mountainproject.com/route/117992796/smurfs-292,2.0,-1,Boulder,V0+,1,,40.04918,-75.03737,"Sit down start with the upside down V crack. Move right to a curved edge, throw to the lip and top out above.Beta Video"
394,394,Neocacher,Geocache Boulder > Pennypack Park > Philly > Southeastern Lowlands > Pennsylvania,https://www.mountainproject.com/route/117815247/neocacher,2.0,-1,Boulder,V0+,1,,40.04918,-75.03737,Start low on an upside down V shaped crack and move up and left along jugs on the overhang. Top out directly above the overhang.Beta Video
395,395,Pocket Query,Geocache Boulder > Pennypack Park > Philly > Southeastern Lowlands > Pennsylvania,https://www.mountainproject.com/route/117815141/pocket-query,2.0,-1,Boulder,V1,1,,40.04918,-75.03737,Same start as First to Find - SDS with low left side pull and right sloper. Move up and right to the long juggy crack. Traverse the crack and top out to the right. Positive holds and tricky feet make for some great climbing.Beta Video
396,396,Muggle Toes,Geocache Boulder > Pennypack Park > Philly > Southeastern Lowlands > Pennsylvania,https://www.mountainproject.com/route/117815293/muggle-toes,3.0,-1,Boulder,V2+,1,,40.04918,-75.03737,Start low on the upside down V shaped crack and move up and left along jugs on the overhanging. Make a wide move to the jug left of the overhang. Move up and left to the top with tricky feet. The top of the overhang is off.Beta Video
397,397,Cache Money,Geocache Boulder > Pennypack Park > Philly > Southeastern Lowlands > Pennsylvania,https://www.mountainproject.com/route/117991995/cache-money,3.0,-1,Boulder,V3,1,,40.04918,-75.03737,Sit down start with the upside down V crack. Traverse right to the long sloping shelf. Continue along the shelf until you reach the large vertical sidepull. Mantle up onto the shelf or top put with a hold high on the large sidepull.Beta Video
398,398,Vangelis,Deer Rock > Pennypack Park > Philly > Southeastern Lowlands > Pennsylvania,https://www.mountainproject.com/route/117819920/vangelis,1.0,-1,Boulder,V0-,1,,40.04762,-75.03718,Climb the shallow arête that runs diagonally up the left of the slab. Grab the undercling/side pull and top out over the block left of the arête.
399,399,Palmtius Pilate,Deer Rock > Pennypack Park > Philly > Southeastern Lowlands > Pennsylvania,https://www.mountainproject.com/route/117820181/palmtius-pilate,2.0,-1,Boulder,V1 PG13,1,,40.04762,-75.03718,Start below the shallow arête with a left side pull and a right sloper. Traverse right following the footholds in the horizontal crack. Move up and topout on the right. Holds on the shallow arête are off.Beta Video
400,400,Tannhauser Gate,Deer Rock > Pennypack Park > Philly > Southeastern Lowlands > Pennsylvania,https://www.mountainproject.com/route/117819536/tannhauser-gate,3.0,-1,Boulder,V2,1,,40.04762,-75.03718,"Begin standing with a left hand on the arête and a low right sidepull. Move up to a curved edge on the face. Slap up the arête and top out.If you can't reach the low right sidepull, you can use the lower right crimp on the face or stand start with only a left hand on the arête.Beta Video"
401,401,Milkweed,Insectarium Boulder > Pennypack Park > Philly > Southeastern Lowlands > Pennsylvania,https://www.mountainproject.com/route/120166325/milkweed,2.0,-1,Boulder,V0-,1,,40.045,-75.02084,SDS matched on low shelf. Move up and left on side pull jugs. Top out with bomber jugs at the lip. Excellent warm up.
402,402,Caterpillar,Insectarium Boulder > Pennypack Park > Philly > Southeastern Lowlands > Pennsylvania,https://www.mountainproject.com/route/120166855/caterpillar,1.0,-1,Boulder,V0,1,,40.045,-75.02084,"SDS with two crimps in the diagonal crack, climb straight up and top out."
403,403,Ovum,Insectarium Boulder > Pennypack Park > Philly > Southeastern Lowlands > Pennsylvania,https://www.mountainproject.com/route/120166922/ovum,1.5,-1,Boulder,V1,1,,40.045,-75.02084,SDS with left crimp and right side pull. Move up on side pulls to a slopey top out.
404,404,Chrysalis,Insectarium Boulder > Pennypack Park > Philly > Southeastern Lowlands > Pennsylvania,https://www.mountainproject.com/route/120166381/chrysalis,3.0,-1,Boulder,V1,1,,40.045,-75.02084,SDS with two side pulls under the bulge. Move up and right on side pulls and top out.
405,405,Monarch,Insectarium Boulder > Pennypack Park > Philly > Southeastern Lowlands > Pennsylvania,https://www.mountainproject.com/route/120166360/monarch,3.0,-1,Boulder,V3,1,,40.045,-75.02084,Stand start with left under cling at chest-height and right sloper at head-height on the bulge. Move straight up on crimps and top out.
406,406,Project,Insectarium Boulder > Pennypack Park > Philly > Southeastern Lowlands > Pennsylvania,https://www.mountainproject.com/route/120178159/project,3.0,-1,Boulder,V4-5,1,,40.045,-75.02084,SDS with right facing side pulls under the bulge (same start as Chrysalis). Move straight up and finish on Monarch.
407,407,Ten Thousand Feet Up Mega Traverse,Ten Thousand Feet Up Area > Lorimer Park > Philly > Southeastern Lowlands > Pennsylvania,https://www.mountainproject.com/route/116365483/ten-thousand-feet-up-mega-traverse,2.5,-1,Boulder,V-easy,1,70.0,40.09945,-75.07102,"There are many ways to play on this wall but we do one very long traverse that keeps you low, eliminating the need for crash pads. This route begins V-easy and ends V-hard (but I usually climb with ropes so I'm not that familiar with bouldering grades. Open to suggestions.) Start standing on a coffee table size rock. Pretend you are standing on a ledge ten thousand feet up. Proceed through the easy Orangutan/Jungle Traverse, which is an excellent warm-up. Stem through the dihedral. Throw a calf up and around the corner and step up high to keep things easy or stay low around the corner for a challenge. Down-climb or stay low to continue traversing through some wide reaches until reaching another good resting spot. Breeze through a long easy section and then take a rest before the cave. Continue into the cave, being aware of the sharp boulder under your back. Climb up and out of the cave to the right, watching for loose blocks. Try to gain a comfortable stance and rest as if you are ten thousand feet up until you are ready to do it all in reverse!"
408,408,That High Start I Dont Know,Main Boulder > Lorimer Park > Philly > Southeastern Lowlands > Pennsylvania,https://www.mountainproject.com/route/122821319/that-high-start-i-dont-know,2.0,-1,Boulder,V4,1,10.0,40.09729,-75.0742,Start on opposing somewhat positive side pulls  around head height under the end of the roof's prow. Use heels and some compression to climb up and right to the obvious finish jug/horn.J-1 in the PDF guide.
409,409,No Smoking,Temple University > Philly > Southeastern Lowlands > Pennsylvania,https://www.mountainproject.com/route/116363700/no-smoking,1.0,-1,Boulder,V2 R,1,20.0,39.98146,-75.15594,shitty urban boulder problem
410,410,Surfer C Teen Confronts Fear,Haddington Woods > Cobbs Creek > Philly > Southeastern Lowlands > Pennsylvania,https://www.mountainproject.com/route/116754901/surfer-c-teen-confronts-fear,1.0,-1,Boulder,V0-,1,,39.96536,-75.25338,"Start with the right arete and a high left side pull. Move up and right then top out.Beta VidFrom the main trail, walk down the hill towards the river. There will be a dam and some large flat rocks on the right. The boulders are to the right of the dam along the bank."
411,411,Electric Squid,Haddington Woods > Cobbs Creek > Philly > Southeastern Lowlands > Pennsylvania,https://www.mountainproject.com/route/118245146/electric-squid,2.0,-1,Boulder,V1+,1,,39.96536,-75.25338,Sit-down start with a left hand jug and a right pinch in the center crack. Throw a heel and move up the arête.
412,412,Behind The Bank,Haddington Woods > Cobbs Creek > Philly > Southeastern Lowlands > Pennsylvania,https://www.mountainproject.com/route/116754962/behind-the-bank,2.0,-1,Boulder,V2,1,,39.96536,-75.25338,Sit-down start with a left crimp and a right pinch on the arête. Tough move to the lip then mantle it out.
413,413,Project,Haddington Woods > Cobbs Creek > Philly > Southeastern Lowlands > Pennsylvania,https://www.mountainproject.com/route/117300843/project,1.0,-1,Boulder,V4,1,,39.96536,-75.25338,SDS with the same finish as Surfer.
414,414,Project,Haddington Woods > Cobbs Creek > Philly > Southeastern Lowlands > Pennsylvania,https://www.mountainproject.com/route/116754813/project,2.0,-1,Boulder,V5,1,,39.96536,-75.25338,Climb left along the slopey ledge to the left arête and top out.
415,415,Indian Creek Traverse,Indian Creek Boulder > Cobbs Creek > Philly > Southeastern Lowlands > Pennsylvania,https://www.mountainproject.com/route/117133702/indian-creek-traverse,2.0,-1,Boulder,V0+,1,,39.97745,-75.26025,"SDS on the far left, traverse right avoiding the top lip then top out. This a pretty long climb and you could make it a V2 with some eliminations."
416,416,V Zorro,Picasso Wall > Quarry 1 > Cobbs Creek > Philly > Southeastern Lowlands > Pennsylvania,https://www.mountainproject.com/route/117137504/v-zorro,1.0,-1,Boulder,V0,1,,39.97742,-75.25845,Start on the low shelf with smeary feet. Move up to the central jug and match at the top to finish.Beta Vid
417,417,Zorro Dyno,Picasso Wall > Quarry 1 > Cobbs Creek > Philly > Southeastern Lowlands > Pennsylvania,https://www.mountainproject.com/route/117137684/zorro-dyno,1.0,-1,Boulder,V1,1,,39.97742,-75.25845,Start on the lower ledge and move up to the central jug. Dyno to the top. Left undercling and right end of ledge are off.
418,418,Junk Dunk,Dr. Strangelove > Quarry 1 > Cobbs Creek > Philly > Southeastern Lowlands > Pennsylvania,https://www.mountainproject.com/route/117134081/junk-dunk,3.0,-1,Boulder,V2+,1,,39.97743,-75.2581,Start matched in a small pocket at the bottom right. Move left onto the arête with a flakey right jug. Move left past a mossy shelf to the second arête. Make a big move up to the rail along the protruding block. Traverse to the nose.The large shelf under the start and the wall to the right is off. The loose pointed block between the arêtes and the loose right side of the rail are also off.Beta Vid
419,419,Dr Strangelove,Dr. Strangelove > Quarry 1 > Cobbs Creek > Philly > Southeastern Lowlands > Pennsylvania,https://www.mountainproject.com/route/117134044/dr-strangelove,3.0,-1,Boulder,V3+,1,,39.97743,-75.2581,Start matched in a small pocket at the bottom right. Move left onto the arête with a flakey right jug. Move left past a mossy shelf to the second arête. Make a big move up to the rail along the protruding block. Traverse to the nose and topout.Take a moment to do your best Slim Pickens.The large shelf under the start and the wall to the right is off. The loose pointed block between the arêtes and the loose right side of the rail are also off.
420,420,Blowhole,Beached Boulder > Cobbs Creek > Philly > Southeastern Lowlands > Pennsylvania,https://www.mountainproject.com/route/117561317/blowhole,0.5,-1,Boulder,V0,1,,39.96518,-75.25129,"Start matched on the lowest rail on the left. Bump up to the lip, find a nice round pocket, and top out.There was a recent break on this problem so beware that some of the rock above the start may be loose."
421,421,Early 70S Gymnastics,Beached Boulder > Cobbs Creek > Philly > Southeastern Lowlands > Pennsylvania,https://www.mountainproject.com/route/117295169/early-70s-gymnastics,2.0,-1,Boulder,V0+,1,,39.96518,-75.25129,Start on a nice left edge and the right arête. Move up to a tiny rail and small nubs. Reach back for a better hold and top out. Kinda strenuous. Beware the dab.Beta Vid
422,422,Unicorns In Paradise,Beached Boulder > Cobbs Creek > Philly > Southeastern Lowlands > Pennsylvania,https://www.mountainproject.com/route/117295703/unicorns-in-paradise,3.0,-1,Boulder,V1,1,,39.96518,-75.25129,Start on good edges in the middle of the face with smeary feet. Triple bump to the top on the left. Throw a heel then reach for a sloper on the right. Top out.Beta Vid
423,423,Raining Blubber,Beached Boulder > Cobbs Creek > Philly > Southeastern Lowlands > Pennsylvania,https://www.mountainproject.com/route/117553160/raining-blubber,3.0,-1,Boulder,V1+,1,,39.96518,-75.25129,"Start on a left sidepull and a right crimp in the face. Move up to slopers and top out with a crimpy gaston.Project: Start on the lowest section of the left sidepull and the right crimp in the face. The feet at this angle are rough, probably a V3."
424,424,Happy Birthday Arete,Quarantine Boulders > Cobbs Creek > Philly > Southeastern Lowlands > Pennsylvania,https://www.mountainproject.com/route/119256664/happy-birthday-arete,1.0,-1,Boulder,V-easy,1,,39.96573,-75.25434,"Stand start with jugs, climb the short arête. A SDS seems possible but the small tree makes it pretty awkward.Beta Video"
425,425,Purell,Quarantine Boulders > Cobbs Creek > Philly > Southeastern Lowlands > Pennsylvania,https://www.mountainproject.com/route/119256720/purell,1.0,-1,Boulder,V-easy,1,,39.96573,-75.25434,SDS on right side of overhang. Traverse left and top out.Beta Video
426,426,Anthony Slouchi,Quarantine Boulders > Cobbs Creek > Philly > Southeastern Lowlands > Pennsylvania,https://www.mountainproject.com/route/120707523/anthony-slouchi,2.0,-1,Boulder,V0,1,,39.96573,-75.25434,Sit down start with sidepull crimps at waist height. Gain the lip and top out. The large pedestal out right is off.
427,427,Droplet,Quarantine Boulders > Cobbs Creek > Philly > Southeastern Lowlands > Pennsylvania,https://www.mountainproject.com/route/119256551/droplet,2.0,-1,Boulder,V0+,1,,39.96573,-75.25434,SDS with left sidepull jug and right crimp. Make one big move to gain the lip and top out.Beta Video
428,428,Virulence,Quarantine Boulders > Cobbs Creek > Philly > Southeastern Lowlands > Pennsylvania,https://www.mountainproject.com/route/119256622/virulence,2.0,-1,Boulder,V1,1,,39.96573,-75.25434,SDS with left sidepull jug and right crimp. Gain the lip and transverse right as far as possible before topping out. The two large pedestals at the base are off for feet.Beta Video
429,429,Social Distancing,Quarantine Boulders > Cobbs Creek > Philly > Southeastern Lowlands > Pennsylvania,https://www.mountainproject.com/route/119256758/social-distancing,3.0,-1,Boulder,V1,1,,39.96573,-75.25434,Start matched on the far left end of the lip. Traverse right and top out around the corner.Beta Video
430,430,Chillin Out Vaxin,Quarantine Boulders > Cobbs Creek > Philly > Southeastern Lowlands > Pennsylvania,https://www.mountainproject.com/route/120707585/chillin-out-vaxin,3.0,-1,Boulder,V3,1,,39.96573,-75.25434,Stand start on the far right of the lip with a right jug and a left sloper. Traverse left across the lip and around the corner. Top out same as Happy Birthday Arete.
431,431,The Direct,Wall Park Boulder > Philly > Southeastern Lowlands > Pennsylvania,https://www.mountainproject.com/route/121980610/the-direct,2.0,-1,Boulder,V0,1,8.0,40.07778,-75.12878,The easiest/simplest climb on the boulder. Share a start with Pinchy and link into Crimps N Slots. Head straight up for the first ledge and topout.
432,432,Crimps N Slots,Wall Park Boulder > Philly > Southeastern Lowlands > Pennsylvania,https://www.mountainproject.com/route/121980570/crimps-n-slots,2.0,-1,Boulder,V1,1,8.0,40.07778,-75.12878,"Traverse left through slots until arete and then make move straight up, topping out on the first ledge. (Not Marco Polo topout)"
433,433,Pinchy,Wall Park Boulder > Philly > Southeastern Lowlands > Pennsylvania,https://www.mountainproject.com/route/121980603/pinchy,2.0,-1,Boulder,V2,1,10.0,40.07778,-75.12878,"Start the same as ""The Direct"", low and left, and make moves to a right handed pinch. The first ledge is OFF (""The Direct"" topout). Instead reach far for a crimp below the second ledge. Proceed to the top with other holds."
434,434,Marco Polo,Wall Park Boulder > Philly > Southeastern Lowlands > Pennsylvania,https://www.mountainproject.com/route/121980618/marco-polo,3.0,-1,Boulder,V2,1,10.0,40.07778,-75.12878,"Probably has the nicest movement on the boulder. Move through cracks, sidepulls and slopers to the top."
435,435,High Tensions,Wall Park Boulder > Philly > Southeastern Lowlands > Pennsylvania,https://www.mountainproject.com/route/121980640/high-tensions,3.0,-1,Boulder,V2,1,12.0,40.07778,-75.12878,"The tallest line on the boulder which gets a bit scary because you feel like you're over a rock. For the full value line, start on ""The Direct"" and traverse right into the start."
436,436,Rarete,Yorktown Plaza > Philly > Southeastern Lowlands > Pennsylvania,https://www.mountainproject.com/route/121980755/rarete,3.0,-1,Boulder,V2,1,20.0,40.07917,-75.12684,Crux is early on again. The landing on this one isn't great with a big tree stump in the way. Spotter would be nice. Move onto the arete and maybe sneak a right heel hook on the start hold to move to better holds.
437,437,Cosi Dyno,Yorktown Plaza > Philly > Southeastern Lowlands > Pennsylvania,https://www.mountainproject.com/route/121980738/cosi-dyno,4.0,-1,Boulder,V4,1,20.0,40.07917,-75.12684,"First move is crux. Dyno with bad feet to a good sloper. This move could be harder than V4 but once you stick it, the climb is just about over. Climb through one more reachy move after the dyno to jugs."
438,438,Mini Crack,Downingtown Boulders > Southeastern Lowlands > Pennsylvania,https://www.mountainproject.com/route/108036047/mini-crack,1.3,-1,Boulder,V0-,1,7.0,39.9777,-75.6812,The problem is a fun warm up to do. It is a crack with some pretty chunky holds on it.
439,439,Belly Flop,Downingtown Boulders > Southeastern Lowlands > Pennsylvania,https://www.mountainproject.com/route/108838659/belly-flop,1.0,-1,Boulder,V0,1,7.0,39.9777,-75.6812,Start on an undercling and side pull. Reach for the lip and top out.
440,440,Waterfall,Downingtown Boulders > Southeastern Lowlands > Pennsylvania,https://www.mountainproject.com/route/108838688/waterfall,0.5,-1,Boulder,V0,1,7.0,39.9777,-75.6812,"You start with two wide underclings to get up onto the slab, which is the crux. Then climb the sob to the top"
441,441,Run Off,Downingtown Boulders > Southeastern Lowlands > Pennsylvania,https://www.mountainproject.com/route/108838697/run-off,0.5,-1,Boulder,V0,1,8.0,39.9777,-75.6812,Sit start on a crimp and pocket and make a big move to a jug and top out.
442,442,After Hours,Downingtown Boulders > Southeastern Lowlands > Pennsylvania,https://www.mountainproject.com/route/112919867/after-hours,1.0,-1,Boulder,V0-1,1,12.0,39.9777,-75.6812,"Sharp crimps and some flakes at the top, topout is the crux."
443,443,Business Time,Downingtown Boulders > Southeastern Lowlands > Pennsylvania,https://www.mountainproject.com/route/108036032/business-time,1.5,-1,Boulder,V2,1,10.0,39.9777,-75.6812,"The start of the problem is on the lower right hand corner of the boulder. Then you traverse to where the boulder and the tree meet, then you top out."
444,444,Business Time Direct,Downingtown Boulders > Southeastern Lowlands > Pennsylvania,https://www.mountainproject.com/route/108838582/business-time-direct,1.0,-1,Boulder,V3,1,12.0,39.9777,-75.6812,Start in the middle of the same boulder as Business Time on two crimps. Move up to a flake and traverse left to the same top out as Business Time.
445,445,Broken Heart,Ridley Creek Boulders > Southeastern Lowlands > Pennsylvania,https://www.mountainproject.com/route/108959048/broken-heart,2.1,-1,Boulder,V0,1,6.0,39.94528,-75.42376,This problem is found on the main boulder on the right side. The side resembles a heart. It is a simple crack problem. Its a short crack climb that starts with right foot out on a small rock in the ground and then a wide left foot on the base of the main boulder. Start with hands in the crack then cross hands up further on the crack and then bring right foot over to left foot and back flag the left. Move up the crack crossing hands and then pull up on top of boulder to top out.
446,446,Ridleys Oyster Shell,Ridley Creek Boulders > Southeastern Lowlands > Pennsylvania,https://www.mountainproject.com/route/109073936/ridleys-oyster-shell,2.0,-1,Boulder,V0-1,1,7.0,39.94528,-75.42376,Start with a hang start with feet on small rock under the first ledge. Cross left hand to small crimp swing out to grab a crimp on the other side of the ledge with right hand. While hanging throw a heel hook with right foot while flagging with left. Crank up and grab the point of the second ledge. Step up and top out.
447,447,Ridleys Gap,Ridley Creek Boulders > Southeastern Lowlands > Pennsylvania,https://www.mountainproject.com/route/108959788/ridleys-gap,2.0,-1,Boulder,V0-1,1,10.0,39.94528,-75.42376,This problem starts with two feet on a smaller rock and two hands low on the first part of the boulder. Cross with your right hand further up on the same part you started on and then match hands. Throw a heel hook with your left foot to the edge. Put your right foot up onto the second part of the boulder and push up to grab with your right hand to the top part of the second part of the boulder and match hands. Then work your way up to the top using the edge of the boulder for feet. Top out.
448,448,Two Humps,Ridley Creek Boulders > Southeastern Lowlands > Pennsylvania,https://www.mountainproject.com/route/109073916/two-humps,2.5,-1,Boulder,V0-1,1,6.0,39.94528,-75.42376,Its a shorter problem if you have a crash pad bring it!
449,449,Typical Birds Boro,Warm up boulder > Hay Creek Boulders > Southeastern Lowlands > Pennsylvania,https://www.mountainproject.com/route/111605962/typical-birds-boro,1.5,-1,Boulder,V-easy,1,21.0,40.23926,-75.83344,Climb the slab face next to the roof on the left.
450,450,Easy Street,Warm up boulder > Hay Creek Boulders > Southeastern Lowlands > Pennsylvania,https://www.mountainproject.com/route/111605978/easy-street,1.0,-1,Boulder,V-easy,1,12.0,40.23926,-75.83344,Climb the slab face. watch for loose pebbles.
451,451,Crack Ladder,Warm up boulder > Hay Creek Boulders > Southeastern Lowlands > Pennsylvania,https://www.mountainproject.com/route/111605755/crack-ladder,1.5,-1,Boulder,V-easy,1,12.0,40.23926,-75.83344,stem your way up the crack in corner.
452,452,Stupid White Man,Warm up boulder > Hay Creek Boulders > Southeastern Lowlands > Pennsylvania,https://www.mountainproject.com/route/111606018/stupid-white-man,2.0,-1,Boulder,V0-,1,10.0,40.23926,-75.83344,Step out on the ledge and climb the face
453,453,No Name,Warm up boulder > Hay Creek Boulders > Southeastern Lowlands > Pennsylvania,https://www.mountainproject.com/route/111606034/no-name,2.0,-1,Boulder,V0,1,11.0,40.23926,-75.83344,Start on the corner and make your way up  on the left side of the face
454,454,Ren And Stimpy,Warm up boulder > Hay Creek Boulders > Southeastern Lowlands > Pennsylvania,https://www.mountainproject.com/route/111606044/ren-and-stimpy,2.0,-1,Boulder,V0,1,10.0,40.23926,-75.83344,Climb the arête.
455,455,Muddy Mud Skipper,Warm up boulder > Hay Creek Boulders > Southeastern Lowlands > Pennsylvania,https://www.mountainproject.com/route/111606055/muddy-mud-skipper,2.0,-1,Boulder,V0,1,10.0,40.23926,-75.83344,Climb the crack
456,456,One Pump Chump,Warm up boulder > Hay Creek Boulders > Southeastern Lowlands > Pennsylvania,https://www.mountainproject.com/route/111605950/one-pump-chump,2.0,-1,Boulder,V1,1,12.0,40.23926,-75.83344,crux is the start. climb up into the roof. pull roof on right side of the arête and finish up the slab.
